{
  "meta": {
    "version": "1.1.0",
    "generatedAt": "2026-06-03",
    "source": "Built from the full 'Orthodox Jewish Study Resources' reference document. v1.1 adds uiLanguages (interface/navigation language) and Hebrew-UI-only sources.",
    "disclaimer": "Leadership and URL details drift over time; entries flagged for human verification should be confirmed before publishing."
  },
  "traditions": [
    {
      "id": "universal",
      "parentId": null,
      "name": "Universal / Cross-Denominational",
      "level": "branch",
      "description": "Resources used across all Orthodox communities.",
      "primaryLanguages": [
        "he",
        "en"
      ],
      "audioFirst": false
    },
    {
      "id": "haredi",
      "parentId": null,
      "name": "Haredi",
      "level": "branch"
    },
    {
      "id": "hasidic",
      "parentId": "haredi",
      "name": "Hasidic",
      "level": "stream"
    },
    {
      "id": "litvish",
      "parentId": "haredi",
      "name": "Litvish / Yeshivish",
      "level": "stream",
      "description": "Non-Hasidic Lithuanian stream; intensive Talmud study rooted in the Vilna Gaon.",
      "primaryLanguages": [
        "en",
        "he"
      ],
      "audioFirst": false
    },
    {
      "id": "chabad",
      "parentId": "hasidic",
      "name": "Chabad-Lubavitch",
      "level": "dynasty",
      "primaryLanguages": [
        "en",
        "he"
      ],
      "audioFirst": false
    },
    {
      "id": "breslov",
      "parentId": "hasidic",
      "name": "Breslov",
      "level": "dynasty",
      "primaryLanguages": [
        "en",
        "he"
      ],
      "audioFirst": false
    },
    {
      "id": "ger",
      "parentId": "hasidic",
      "name": "Ger (Gur)",
      "level": "dynasty",
      "altNames": [
        "Gur"
      ],
      "primaryLanguages": [
        "he",
        "yi"
      ],
      "audioFirst": false
    },
    {
      "id": "satmar",
      "parentId": "hasidic",
      "name": "Satmar",
      "level": "dynasty",
      "primaryLanguages": [
        "yi"
      ],
      "audioFirst": true,
      "notes": "Split between Kiryas Joel/Monroe (R. Aron Teitelbaum) and Williamsburg (R. Zalman Leib Teitelbaum) — verify before publishing."
    },
    {
      "id": "belz",
      "parentId": "hasidic",
      "name": "Belz",
      "level": "dynasty",
      "primaryLanguages": [
        "yi",
        "he"
      ],
      "audioFirst": true
    },
    {
      "id": "vizhnitz",
      "parentId": "hasidic",
      "name": "Vizhnitz",
      "level": "dynasty",
      "altNames": [
        "Viznitz"
      ],
      "primaryLanguages": [
        "yi",
        "he"
      ],
      "audioFirst": true
    },
    {
      "id": "bobov",
      "parentId": "hasidic",
      "name": "Bobov",
      "level": "dynasty",
      "primaryLanguages": [
        "yi",
        "he"
      ],
      "audioFirst": true
    },
    {
      "id": "skver",
      "parentId": "hasidic",
      "name": "Skver",
      "level": "dynasty",
      "altNames": [
        "Skvyra"
      ],
      "primaryLanguages": [
        "yi",
        "he"
      ],
      "audioFirst": true
    },
    {
      "id": "munkatch",
      "parentId": "hasidic",
      "name": "Munkatch",
      "level": "dynasty",
      "altNames": [
        "Munkacs",
        "Munkács",
        "Minkatch"
      ],
      "primaryLanguages": [
        "yi",
        "he"
      ],
      "audioFirst": true,
      "notes": "Hungarian anti-Zionist dynasty (~2,500 families); associated with the Minchas Elazar."
    },
    {
      "id": "modern-orthodox",
      "parentId": null,
      "name": "Modern Orthodox",
      "level": "branch",
      "primaryLanguages": [
        "en",
        "he"
      ],
      "audioFirst": false
    },
    {
      "id": "sephardic",
      "parentId": null,
      "name": "Sephardic / Mizrahi",
      "level": "branch",
      "description": "Several distinct rites, not one bloc.",
      "primaryLanguages": [
        "he",
        "en"
      ],
      "audioFirst": false
    },
    {
      "id": "sephardic-ovadia",
      "parentId": "sephardic",
      "name": "Rav Ovadia mainstream",
      "level": "rite",
      "primaryLanguages": [
        "he"
      ],
      "audioFirst": false
    },
    {
      "id": "sephardic-syrian",
      "parentId": "sephardic",
      "name": "Syrian / Aleppo (Halab)",
      "level": "rite",
      "primaryLanguages": [
        "en",
        "he"
      ],
      "audioFirst": false
    },
    {
      "id": "sephardic-iraqi",
      "parentId": "sephardic",
      "name": "Iraqi / Baghdadi",
      "level": "rite",
      "primaryLanguages": [
        "he"
      ],
      "audioFirst": false
    },
    {
      "id": "sephardic-moroccan",
      "parentId": "sephardic",
      "name": "Moroccan / North African",
      "level": "rite",
      "altNames": [
        "Maghrebi"
      ],
      "primaryLanguages": [
        "he",
        "fr"
      ],
      "audioFirst": false
    },
    {
      "id": "sephardic-yemenite",
      "parentId": "sephardic",
      "name": "Yemenite (Teimani)",
      "level": "rite",
      "altNames": [
        "Baladi",
        "Shami",
        "Dor Daim"
      ],
      "primaryLanguages": [
        "he"
      ],
      "audioFirst": false
    },
    {
      "id": "sephardic-spanish-portuguese",
      "parentId": "sephardic",
      "name": "Spanish & Portuguese",
      "level": "rite",
      "altNames": [
        "Western Sephardim",
        "S&P"
      ],
      "primaryLanguages": [
        "en",
        "he"
      ],
      "audioFirst": false
    },
    {
      "id": "bnei-anusim",
      "parentId": "sephardic",
      "name": "Bnei Anusim",
      "level": "community",
      "altNames": [
        "Anusim",
        "Crypto-Jews",
        "Conversos",
        "Marranos",
        "B'nai Anusim"
      ],
      "primaryLanguages": [
        "es",
        "pt"
      ],
      "audioFirst": false,
      "notes": "Descendants of Sephardic/Portuguese Jews forcibly converted during the Inquisition who are reconnecting with Judaism. A community defined by history and return, not a distinct rite; returnees generally adopt mainstream Sephardic practice."
    },
    {
      "id": "beta-israel",
      "parentId": null,
      "name": "Beta Israel (Ethiopian)",
      "level": "community",
      "altNames": [
        "Ethiopian Jewry"
      ],
      "description": "Non-rabbinic Haymanot tradition, oral and in Ge'ez. Most adherents in Israel now practice Sephardic-style rabbinic Orthodoxy.",
      "primaryLanguages": [
        "gez",
        "he"
      ],
      "audioFirst": false,
      "notes": "Heritage material lives in academic archives, not study platforms; build with community input."
    },
    {
      "id": "bnei-menashe",
      "parentId": null,
      "name": "Bnei Menashe",
      "level": "community",
      "altNames": [
        "Children of Manasseh",
        "Shinlung",
        "Bene Menashe",
        "B'nei Menashe"
      ],
      "description": "Community from Mizoram and Manipur in northeast India (Chin/Kuki/Mizo ethnic groups) who claim descent from the lost tribe of Manasseh and have adopted Judaism. ~10,000 members; ~5,000 have made aliyah, the rest awaiting it.",
      "primaryLanguages": [
        "en",
        "he"
      ],
      "audioFirst": false,
      "notes": "Emerging/returning community, not a classical rite. Recognized as a 'lost tribe' group by a 2005 Israeli Chief Rabbi ruling, but members undergo formal Orthodox conversion on arrival; halachic and historical status are debated. Present as community + supporting organizations, not a status ruling."
    }
  ],
  "authorities": [
    {
      "id": "ovadia-yosef",
      "name": "Rav Ovadia Yosef",
      "role": [
        "posek",
        "author"
      ],
      "traditionIds": [
        "sephardic-ovadia"
      ],
      "lifespan": "1920-2013"
    },
    {
      "id": "yitzchak-yosef",
      "name": "Rabbi Yitzchak Yosef",
      "role": [
        "posek",
        "author"
      ],
      "traditionIds": [
        "sephardic-ovadia"
      ],
      "lifespan": "b. 1952",
      "notes": "Author of Yalkut Yosef; son of Rav Ovadia; former Rishon LeZion."
    },
    {
      "id": "yosef-chaim-baghdad",
      "name": "Rabbi Yosef Chaim of Baghdad",
      "altNames": [
        "Ben Ish Chai"
      ],
      "role": [
        "posek",
        "author"
      ],
      "traditionIds": [
        "sephardic-iraqi",
        "sephardic"
      ],
      "lifespan": "1835-1909"
    },
    {
      "id": "yaakov-chaim-sofer",
      "name": "Rabbi Yaakov Chaim Sofer",
      "altNames": [
        "Kaf HaChaim"
      ],
      "role": [
        "posek",
        "author"
      ],
      "traditionIds": [
        "sephardic-iraqi"
      ],
      "lifespan": "1870-1939"
    },
    {
      "id": "shalom-messas",
      "name": "Rabbi Shalom Messas",
      "role": [
        "posek",
        "author"
      ],
      "traditionIds": [
        "sephardic-moroccan"
      ],
      "lifespan": "1909-2003",
      "notes": "Chief Sephardic rabbi of Jerusalem; leading 20th-c. Moroccan posek."
    },
    {
      "id": "mordechai-lebhar",
      "name": "Rabbi Mordechai Lebhar",
      "altNames": [
        "Magen Avot"
      ],
      "role": [
        "posek",
        "author",
        "maggid-shiur"
      ],
      "traditionIds": [
        "sephardic-moroccan"
      ],
      "notes": "Author of Magen Avot; emerging leader in the Moroccan rabbinate (Montreal/LA)."
    },
    {
      "id": "yaakov-menashe",
      "name": "Rabbi Yaakov Menashe",
      "role": [
        "maggid-shiur",
        "author"
      ],
      "traditionIds": [
        "sephardic-iraqi"
      ],
      "notes": "Founder of Midrash Ben Ish Hai / A Torah Minute; serves the Baghdadi diaspora."
    },
    {
      "id": "david-yosef",
      "name": "Rabbi David Yosef",
      "altNames": [
        "Halacha Brura"
      ],
      "role": [
        "posek",
        "author"
      ],
      "traditionIds": [